restaurant_code,review_title,account_name,new_aspect_1,phrase,phrase_lemma,phrase_stem,phrase_emoticon_generic,phrase_emoticon_unique,phrase_stem_emoticon_generic,phrase_lemma_emoticon_generic,phrase_stem_emoticon_unique,phrase_lemma_emoticon_unique,label
cafe-de-muse,Strawberry Bingsu,Xing Wei Chua,food,think pasta brunch western cuisine korean bingsu alongside specialty coffee sliced cakes display actually pretty decent shavings distinct flaky milky fragrance unnecessarily sweet sogginess fresh cream isetan scotts serving cafe grub think pasta brunch western cuisine korean bingsu alongside specialty coffee sliced cakes display counter,think pasta brunch western cuisine korean bingsu alongside specialty coffee sliced cake display actually pretty decent shaving distinct flaky milky fragrance unnecessarily sweet sogginess fresh cream isetan scott serving cafe grub think pasta brunch western cuisine korean bingsu alongside specialty coffee sliced cake display counter,think pasta brunch western cuisin korean bingsu alongsid specialti coffe slice cake display actual pretti decent shave distinct flaki milki fragranc unnecessarili sweet soggi fresh cream isetan scott serv cafe grub think pasta brunch western cuisin korean bingsu alongsid specialti coffe slice cake display counter,think pasta brunch western cuisine korean bingsu alongside specialty coffee sliced cakes display actually pretty decent shavings distinct flaky milky fragrance unnecessarily sweet sogginess fresh cream isetan scotts serving cafe grub think pasta brunch western cuisine korean bingsu alongside specialty coffee sliced cakes display counter,think pasta brunch western cuisine korean bingsu alongside specialty coffee sliced cakes display actually pretty decent shavings distinct flaky milky fragrance unnecessarily sweet sogginess fresh cream isetan scotts serving cafe grub think pasta brunch western cuisine korean bingsu alongside specialty coffee sliced cakes display counter,think pasta brunch western cuisin korean bingsu alongsid specialti coffe slice cake display actual pretti decent shave distinct flaki milki fragranc unnecessarili sweet soggi fresh cream isetan scott serv cafe grub think pasta brunch western cuisin korean bingsu alongsid specialti coffe slice cake display counter,think pasta brunch western cuisine korean bingsu alongside specialty coffee sliced cake display actually pretty decent shaving distinct flaky milky fragrance unnecessarily sweet sogginess fresh cream isetan scott serving cafe grub think pasta brunch western cuisine korean bingsu alongside specialty coffee sliced cake display counter,think pasta brunch western cuisin korean bingsu alongsid specialti coffe slice cake display actual pretti decent shave distinct flaki milki fragranc unnecessarili sweet soggi fresh cream isetan scott serv cafe grub think pasta brunch western cuisin korean bingsu alongsid specialti coffe slice cake display counter,think pasta brunch western cuisine korean bingsu alongside specialty coffee sliced cake display actually pretty decent shaving distinct flaky milky fragrance unnecessarily sweet sogginess fresh cream isetan scott serving cafe grub think pasta brunch western cuisine korean bingsu alongside specialty coffee sliced cake display counter,1.0
cafe-de-muse,Strawberry Bingsu,Xing Wei Chua,price,reasonable price came reasonable price,reasonable price came reasonable price,reason price came reason price,reasonable price came reasonable price,reasonable price came reasonable price,reason price came reason price,reasonable price came reasonable price,reason price came reason price,reasonable price came reasonable price,1.0
cafe-de-muse,Strawberry Bingsu,Xing Wei Chua,time,dramatic appearance minute wait not sure waiting time took wayyyy long,dramatic appearance minute wait not sure waiting time took wayyyy long,dramat appear minut wait not sure wait time took wayyyi long,dramatic appearance minute wait not sure waiting time took wayyyy long,dramatic appearance minute wait not sure waiting time took wayyyy long,dramat appear minut wait not sure wait time took wayyyi long,dramatic appearance minute wait not sure waiting time took wayyyy long,dramat appear minut wait not sure wait time took wayyyi long,dramatic appearance minute wait not sure waiting time took wayyyy long,-1.0
carpenter-and-cook,#instacake #instagram #instaphoto #instagrammers #instafood #instasg #instafoodie #instagrapher #yummy #delicious #pastry #foodartstylesgf #lifeisdeliciousinsingapore #gf_singapore #8dayseatout you want cake?,Viline Teo,food,yummy delicious pastry,yummy delicious pastry,yummi delici pastri,yummy delicious pastry,yummy delicious pastry,yummi delici pastri,yummy delicious pastry,yummi delici pastri,yummy delicious pastry,1.0
carpenter-and-cook,All Time Favourite Tarts,Cherisology .,food,favourite tartspassionfruit meringue tart maldon sea salt caramel favourite tartspassionfruit meringue tart chocolate maldon,favourite tartspassionfruit meringue tart maldon sea salt caramel favourite tartspassionfruit meringue tart chocolate maldon,favourit tartspassionfruit meringu tart maldon sea salt caramel favourit tartspassionfruit meringu tart chocol maldon,favourite tartspassionfruit meringue tart maldon sea salt caramel favourite tartspassionfruit meringue tart chocolate maldon,favourite tartspassionfruit meringue tart maldon sea salt caramel favourite tartspassionfruit meringue tart chocolate maldon,favourit tartspassionfruit meringu tart maldon sea salt caramel favourit tartspassionfruit meringu tart chocol maldon,favourite tartspassionfruit meringue tart maldon sea salt caramel favourite tartspassionfruit meringue tart chocolate maldon,favourit tartspassionfruit meringu tart maldon sea salt caramel favourit tartspassionfruit meringu tart chocol maldon,favourite tartspassionfruit meringue tart maldon sea salt caramel favourite tartspassionfruit meringue tart chocolate maldon,1.0
carpenter-and-cook,Almond Croissant ($4.50),aggs & xi :D,food,taste better good good good,taste better good good good,tast better good good good,taste better good good good,taste better good good good,tast better good good good,taste better good good good,tast better good good good,taste better good good good,1.0
carpenter-and-cook,Amazing Mushroom and Red Pepper Quiche!,Lance Teo,food,red pepper,red pepper,red pepper,red pepper,red pepper,red pepper,red pepper,red pepper,red pepper,0.0
carpenter-and-cook,Bacon and mushroom quiche.,Huiyi Lee,food,mushroom quiche,mushroom quiche,mushroom quich,mushroom quiche,mushroom quiche,mushroom quich,mushroom quiche,mushroom quich,mushroom quiche,0.0
carpenter-and-cook,"Banana 🍌 & Strawberries Smoothie
.",umakemehungry :),food,strawberries smoothie,strawberry smoothie,strawberri smoothi,strawberries smoothie,strawberries smoothie,strawberri smoothi,strawberry smoothie,strawberri smoothi,strawberry smoothie,0.0
carpenter-and-cook,Caffè Mocha,Wen Qi,food,special,special,special,special,special,special,special,special,special,1.0
carpenter-and-cook,Caffè Mocha,Wen Qi,price,no additional gst service charge no additional gst service charge,no additional gst service charge no additional gst service charge,no addit gst servic charg no addit gst servic charg,no additional gst service charge no additional gst service charge,no additional gst service charge no additional gst service charge,no addit gst servic charg no addit gst servic charg,no additional gst service charge no additional gst service charge,no addit gst servic charg no addit gst servic charg,no additional gst service charge no additional gst service charge,1.0
carpenter-and-cook,Cappuccino,Derek Phang,food,limited,limited,limit,limited,limited,limit,limited,limit,limited,-1.0
carpenter-and-cook,Carpenter And Cook,k Meisian,food,average price avg taste,average price avg taste,averag price avg tast,average price avg taste,average price avg taste,averag price avg tast,average price avg taste,averag price avg tast,average price avg taste,0.0
carpenter-and-cook,Carpenter And Cook,k Meisian,price,average price,average price,averag price,average price,average price,averag price,average price,averag price,average price,0.0
carpenter-and-cook,Carpenter and Cook,Regine Ng,food,fantastic coffees good coffees good bitter liking,fantastic coffee good coffee good bitter liking,fantast coffe good coffe good bitter like,fantastic coffees good coffees good bitter liking,fantastic coffees good coffees good bitter liking,fantast coffe good coffe good bitter like,fantastic coffee good coffee good bitter liking,fantast coffe good coffe good bitter like,fantastic coffee good coffee good bitter liking,1.0
carpenter-and-cook,Carpenter and Cook,Regine Ng,service,fantastic,fantastic,fantast,fantastic,fantastic,fantast,fantastic,fantast,fantastic,1.0
carpenter-and-cook,Chocolate sea salt caramel tart,Celest Lim,ambience,laid vibe laid vibe laid vibe,laid vibe laid vibe laid vibe,laid vibe laid vibe laid vibe,laid vibe laid vibe laid vibe,laid vibe laid vibe laid vibe,laid vibe laid vibe laid vibe,laid vibe laid vibe laid vibe,laid vibe laid vibe laid vibe,laid vibe laid vibe laid vibe,0.0
carpenter-and-cook,Chocolate sea salt caramel tart,Celest Lim,food,sea salt tartfinally visit cool small menu worthy bakes nice tart crunchy crust weak small menu worthy bakes small menu worthy bakes,sea salt tartfinally visit cool small menu worthy bakes nice tart crunchy crust weak small menu worthy bakes small menu worthy bakes,sea salt tartfin visit cool small menu worthi bake nice tart crunchi crust weak small menu worthi bake small menu worthi bake,sea salt tartfinally visit cool small menu worthy bakes nice tart crunchy crust weak small menu worthy bakes small menu worthy bakes,sea salt tartfinally visit cool small menu worthy bakes nice tart crunchy crust weak small menu worthy bakes small menu worthy bakes,sea salt tartfin visit cool small menu worthi bake nice tart crunchi crust weak small menu worthi bake small menu worthi bake,sea salt tartfinally visit cool small menu worthy bakes nice tart crunchy crust weak small menu worthy bakes small menu worthy bakes,sea salt tartfin visit cool small menu worthi bake nice tart crunchi crust weak small menu worthi bake small menu worthi bake,sea salt tartfinally visit cool small menu worthy bakes nice tart crunchy crust weak small menu worthy bakes small menu worthy bakes,1.0
carpenter-and-cook,Cook's Amazing Quiche,Sze Wee Ng,food,amazing quichereally damn,amazing quichereally damn,amaz quicher damn,amazing quichereally damn,amazing quichereally damn,amaz quicher damn,amazing quichereally damn,amaz quicher damn,amazing quichereally damn,1.0
carpenter-and-cook,Cook's Amazing Quiche,Ying Hui x,food,amazing quichethe quiche yummy pity portion small iced chocolate tastes like,amazing quichethe quiche yummy pity portion small iced chocolate taste like,amaz quicheth quich yummi piti portion small ice chocol tast like,amazing quichethe quiche yummy pity portion small iced chocolate tastes like,amazing quichethe quiche yummy pity portion small iced chocolate tastes like,amaz quicheth quich yummi piti portion small ice chocol tast like,amazing quichethe quiche yummy pity portion small iced chocolate taste like,amaz quicheth quich yummi piti portion small ice chocol tast like,amazing quichethe quiche yummy pity portion small iced chocolate taste like,1.0
carpenter-and-cook,Cook's Amazing Quiche,Ying Hui x,portion,yummy pity portion small,yummy pity portion small,yummi piti portion small,yummy pity portion small,yummy pity portion small,yummi piti portion small,yummy pity portion small,yummi piti portion small,yummy pity portion small,-1.0
carpenter-and-cook,Craving for their hot chocolate so badly 😱 { they have the yummiest choco } #hot #chocolate #best #cafe #delicious #choco #teatime #throwback,Venesselimys Lim,food,hot chocolate badly yummiest choco best cafe delicious,hot chocolate badly yummiest choco best cafe delicious,hot chocol badli yummiest choco best cafe delici,hot chocolate badly bad yummiest choco best cafe delicious,hot chocolate badly emojibad yummiest choco best cafe delicious,hot chocol badli bad yummiest choco best cafe delici,hot chocolate badly bad yummiest choco best cafe delicious,hot chocol badli emojibad yummiest choco best cafe delici,hot chocolate badly emojibad yummiest choco best cafe delicious,1.0
carpenter-and-cook,Frangipani Berries Tart,Coco Jx,food,tart texture cake tart nice,tart texture cake tart nice,tart textur cake tart nice,tart texture cake tart nice,tart texture cake tart nice,tart textur cake tart nice,tart texture cake tart nice,tart textur cake tart nice,tart texture cake tart nice,1.0
carpenter-and-cook,Ham & cheese quiche,Shirlynn Yang,food,usually love quiche thought pretty good,usually love quiche thought pretty good,usual love quich thought pretti good,usually love quiche thought pretty good,usually love quiche thought pretty good,usual love quich thought pretti good,usually love quiche thought pretty good,usual love quich thought pretti good,usually love quiche thought pretty good,1.0
carpenter-and-cook,Ham & cheese quiche,Shirlynn Yang,service,thought pretty good,thought pretty good,thought pretti good,thought pretty good,thought pretty good,thought pretti good,thought pretty good,thought pretti good,thought pretty good,1.0
carpenter-and-cook,Ham and Emmental Cheese Croissant for lunch.,Keropok Man,food,emmental cheese croissant,emmental cheese croissant,emment chees croissant,emmental cheese croissant,emmental cheese croissant,emment chees croissant,emmental cheese croissant,emment chees croissant,emmental cheese croissant,0.0
carpenter-and-cook,Heavenly Plain Crossiant With Mint Lemonade Fizz,Blur Dino,food,quality good overall service,quality good overall service,qualiti good overal servic,quality good overall service,quality good overall service,qualiti good overal servic,quality good overall service,qualiti good overal servic,quality good overall service,1.0
carpenter-and-cook,Heavenly Plain Crossiant With Mint Lemonade Fizz,Blur Dino,price,good overall,good overall,good overal,good overall,good overall,good overal,good overall,good overal,good overall,1.0
carpenter-and-cook,Heavenly Plain Crossiant With Mint Lemonade Fizz,Blur Dino,service,quality good overall service,quality good overall service,qualiti good overal servic,quality good overall service,quality good overall service,qualiti good overal servic,quality good overall service,qualiti good overal servic,quality good overall service,1.0
carpenter-and-cook,Hot Chocolate // Tiramisu // Hot Tea // Passionfruit Meringue Tart,Amalina Yusni,food,hot tea passionfruit meringue tartahhhhhhhh tart,hot tea passionfruit meringue tartahhhhhhhh tart,hot tea passionfruit meringu tartahhhhhhhh tart,hot tea passionfruit meringue tartahhhhhhhh tart good,hot tea passionfruit meringue tartahhhhhhhh tart emojigood,hot tea passionfruit meringu tartahhhhhhhh tart good,hot tea passionfruit meringue tartahhhhhhhh tart good,hot tea passionfruit meringu tartahhhhhhhh tart emojigood,hot tea passionfruit meringue tartahhhhhhhh tart emojigood,1.0
carpenter-and-cook,Hot Cinnamon Sunset,Peifen Ng,food,cinnamon sunsethot,cinnamon sunsethot,cinnamon sunsethot,cinnamon sunsethot,cinnamon sunsethot,cinnamon sunsethot,cinnamon sunsethot,cinnamon sunsethot,cinnamon sunsethot,0.0
carpenter-and-cook,I can write this place off my wish list :3,Vicki Goh,ambience,write place,write place,write place,write place,write place,write place,write place,write place,write place,0.0
carpenter-and-cook,"Ice cream frenzy express, original outlet at West Coast Drive.",Jennifer Yeo,food,salty caramel swiss dark chocolate new york cheesecake milky soursop fantastic,salty caramel swiss dark chocolate new york cheesecake milky soursop fantastic,salti caramel swiss dark chocol new york cheesecak milki soursop fantast,salty caramel swiss dark chocolate new york cheesecake milky soursop fantastic,salty caramel swiss dark chocolate new york cheesecake milky soursop fantastic,salti caramel swiss dark chocol new york cheesecak milki soursop fantast,salty caramel swiss dark chocolate new york cheesecake milky soursop fantastic,salti caramel swiss dark chocol new york cheesecak milki soursop fantast,salty caramel swiss dark chocolate new york cheesecake milky soursop fantastic,1.0
carpenter-and-cook,Iced Chocolate And Latte,Just Keep Eating,ambience,chill weekend feel not bustling people lattegreat place stop chill weekend feel not bustling people,chill weekend feel not bustling people lattegreat place stop chill weekend feel not bustling people,chill weekend feel not bustl peopl lattegreat place stop chill weekend feel not bustl peopl,chill weekend feel not bustling people lattegreat place stop chill weekend feel not bustling people,chill weekend feel not bustling people lattegreat place stop chill weekend feel not bustling people,chill weekend feel not bustl peopl lattegreat place stop chill weekend feel not bustl peopl,chill weekend feel not bustling people lattegreat place stop chill weekend feel not bustling people,chill weekend feel not bustl peopl lattegreat place stop chill weekend feel not bustl peopl,chill weekend feel not bustling people lattegreat place stop chill weekend feel not bustling people,1.0
carpenter-and-cook,Iced Chocolate And Latte,Just Keep Eating,food,iced chocolate lattegreat place stop,iced chocolate lattegreat place stop,ice chocol lattegreat place stop,iced chocolate lattegreat place stop,iced chocolate lattegreat place stop,ice chocol lattegreat place stop,iced chocolate lattegreat place stop,ice chocol lattegreat place stop,iced chocolate lattegreat place stop,0.0
carpenter-and-cook,Lemon Drizzle Loaf,Rachel Xie,food,lemon drizzle loafparticularly partial cake literally icing,lemon drizzle loafparticularly partial cake literally icing,lemon drizzl loafparticularli partial cake liter ice,lemon drizzle loafparticularly partial cake literally icing,lemon drizzle loafparticularly partial cake literally icing,lemon drizzl loafparticularli partial cake liter ice,lemon drizzle loafparticularly partial cake literally icing,lemon drizzl loafparticularli partial cake liter ice,lemon drizzle loafparticularly partial cake literally icing,0.0
carpenter-and-cook,Lemon Meringue Cake,Foodie Tnt,food,lemon meringue cake lemon meringue cakefirst time eating,lemon meringue cake lemon meringue cakefirst time eating,lemon meringu cake lemon meringu cakefirst time eat,lemon meringue cake lemon meringue cakefirst time eating,lemon meringue cake lemon meringue cakefirst time eating,lemon meringu cake lemon meringu cakefirst time eat,lemon meringue cake lemon meringue cakefirst time eating,lemon meringu cake lemon meringu cakefirst time eat,lemon meringue cake lemon meringue cakefirst time eating,0.0
carpenter-and-cook,Lemon Meringue Cake,Lorraine Ge,food,cakesadly disappointing usually love bakes cake dry relatively bland topped meringue,cakesadly disappointing usually love bakes cake dry relatively bland topped meringue,cakesadli disappoint usual love bake cake dri rel bland top meringu,cakesadly disappointing usually love bakes cake dry relatively bland topped meringue,cakesadly disappointing usually love bakes cake dry relatively bland topped meringue,cakesadli disappoint usual love bake cake dri rel bland top meringu,cakesadly disappointing usually love bakes cake dry relatively bland topped meringue,cakesadli disappoint usual love bake cake dri rel bland top meringu,cakesadly disappointing usually love bakes cake dry relatively bland topped meringue,-1.0
carpenter-and-cook,Lemon Tart & Lemon Drizzle Cake,Maryann Kim,food,lemon tart lemon drizzle cakelemon craving sour sweet crust good grey tea balanced served hot passionfruit sour good crust list,lemon tart lemon drizzle cakelemon craving sour sweet crust good grey tea balanced served hot passionfruit sour good crust list,lemon tart lemon drizzl cakelemon crave sour sweet crust good grey tea balanc serv hot passionfruit sour good crust list,lemon tart lemon drizzle cakelemon craving sour sweet crust good grey tea balanced served hot passionfruit sour good crust list,lemon tart lemon drizzle cakelemon craving sour sweet crust good grey tea balanced served hot passionfruit sour good crust list,lemon tart lemon drizzl cakelemon crave sour sweet crust good grey tea balanc serv hot passionfruit sour good crust list,lemon tart lemon drizzle cakelemon craving sour sweet crust good grey tea balanced served hot passionfruit sour good crust list,lemon tart lemon drizzl cakelemon crave sour sweet crust good grey tea balanc serv hot passionfruit sour good crust list,lemon tart lemon drizzle cakelemon craving sour sweet crust good grey tea balanced served hot passionfruit sour good crust list,1.0
carpenter-and-cook,Mocha And Latte,Just Keep Eating,ambience,nice place chill weekends not overly crowded service,nice place chill weekend not overly crowded service,nice place chill weekend not overli crowd servic,nice place chill weekends not overly crowded service,nice place chill weekends not overly crowded service,nice place chill weekend not overli crowd servic,nice place chill weekend not overly crowded service,nice place chill weekend not overli crowd servic,nice place chill weekend not overly crowded service,1.0
carpenter-and-cook,Mocha And Latte,Just Keep Eating,food,lattedecent coffee nice place chill weekends not overly crowded service,lattedecent coffee nice place chill weekend not overly crowded service,lattedec coffe nice place chill weekend not overli crowd servic,lattedecent coffee nice place chill weekends not overly crowded service,lattedecent coffee nice place chill weekends not overly crowded service,lattedec coffe nice place chill weekend not overli crowd servic,lattedecent coffee nice place chill weekend not overly crowded service,lattedec coffe nice place chill weekend not overli crowd servic,lattedecent coffee nice place chill weekend not overly crowded service,0.0
carpenter-and-cook,Mocha And Latte,Just Keep Eating,service,told slow order saying,told slow order saying,told slow order say,told slow order saying,told slow order saying,told slow order say,told slow order saying,told slow order say,told slow order saying,-1.0
carpenter-and-cook,Oh.,Keropok Man,food,fresh leaves,fresh leaf,fresh leav,fresh leaves,fresh leaves,fresh leav,fresh leaf,fresh leav,fresh leaf,1.0
carpenter-and-cook,Passion Fruit Meringue Tart,Clarice Lam,food,check udders pancake went coffee passionfruit tart good sweet sour good sweet sour,check udder pancake went coffee passionfruit tart good sweet sour good sweet sour,check udder pancak went coffe passionfruit tart good sweet sour good sweet sour,check udders pancake went coffee passionfruit tart good sweet sour good sweet sour,check udders pancake went coffee passionfruit tart good sweet sour good sweet sour,check udder pancak went coffe passionfruit tart good sweet sour good sweet sour,check udder pancake went coffee passionfruit tart good sweet sour good sweet sour,check udder pancak went coffe passionfruit tart good sweet sour good sweet sour,check udder pancake went coffee passionfruit tart good sweet sour good sweet sour,1.0
carpenter-and-cook,Passionfruit Meringue Tart,Serene Choo,ambience,charming place,charming place,charm place,charming place,charming place,charm place,charming place,charm place,charming place,1.0
carpenter-and-cook,Passionfruit Meringue Tart,Serene Choo,food,tartgotta scrummy share,tartgotta scrummy share,tartgotta scrummi share,tartgotta scrummy share,tartgotta scrummy share,tartgotta scrummi share,tartgotta scrummy share,tartgotta scrummi share,tartgotta scrummy share,0.0
carpenter-and-cook,Passionfruit Meringue Tart & Tiramisu,Wen Qi,food,special,special,special,special,special,special,special,special,special,1.0
carpenter-and-cook,Passionfruit Meringue Tart & Tiramisu,Wen Qi,price,no additional gst service charge no additional gst service charge,no additional gst service charge no additional gst service charge,no addit gst servic charg no addit gst servic charg,no additional gst service charge no additional gst service charge,no additional gst service charge no additional gst service charge,no addit gst servic charg no addit gst servic charg,no additional gst service charge no additional gst service charge,no addit gst servic charg no addit gst servic charg,no additional gst service charge no additional gst service charge,1.0
carpenter-and-cook,Passionfruit Meringue Tart ($5.50),Zul Latiff,food,meringue tart devoid carpenter cook petite passionfruit admittedly not favourite table little senseless,meringue tart devoid carpenter cook petite passionfruit admittedly not favourite table little senseless,meringu tart devoid carpent cook petit passionfruit admittedli not favourit tabl littl senseless,meringue tart devoid carpenter cook petite passionfruit admittedly not favourite table little senseless,meringue tart devoid carpenter cook petite passionfruit admittedly not favourite table little senseless,meringu tart devoid carpent cook petit passionfruit admittedli not favourit tabl littl senseless,meringue tart devoid carpenter cook petite passionfruit admittedly not favourite table little senseless,meringu tart devoid carpent cook petit passionfruit admittedli not favourit tabl littl senseless,meringue tart devoid carpenter cook petite passionfruit admittedly not favourite table little senseless,-1.0
carpenter-and-cook,Passionfruit Meringue Tart ($5.50),Zul Latiff,price,come cheap,come cheap,come cheap,come cheap,come cheap,come cheap,come cheap,come cheap,come cheap,1.0
carpenter-and-cook,"Saturday // ""Time is on the side of the oppressed today, it's against the oppressor.",Chez Choong,time,oppressed today,oppressed today,oppress today,oppressed today,oppressed today,oppress today,oppressed today,oppress today,oppressed today,-1.0
