restaurant_code,review_title,account_name,new_aspect_1,phrase,phrase_lemma,phrase_stem,phrase_emoticon_generic,phrase_emoticon_unique,phrase_stem_emoticon_generic,phrase_lemma_emoticon_generic,phrase_stem_emoticon_unique,phrase_lemma_emoticon_unique,label
big-small-restaurant,私房菜,Doreen Tan,food,salt castor sugar tonite sauted tender meat black fungus braised tofu special sauce gold medal pork rib pineapple qiubi prawn interestingly orange juice dragon fruit soya bean milk offered acquired taste especially flavours soy black fungus braised tofu special sauce,salt castor sugar tonite sauted tender meat black fungus braised tofu special sauce gold medal pork rib pineapple qiubi prawn interestingly orange juice dragon fruit soya bean milk offered acquired taste especially flavour soy black fungus braised tofu special sauce,salt castor sugar tonit saut tender meat black fungu brais tofu special sauc gold medal pork rib pineappl qiubi prawn interestingli orang juic dragon fruit soya bean milk offer acquir tast especi flavour soy black fungu brais tofu special sauc,salt castor sugar tonite sauted tender meat black fungus braised tofu special sauce gold medal good pork rib pineapple qiubi prawn interestingly orange juice dragon fruit soya bean milk offered acquired taste especially flavours soy black fungus braised tofu special sauce,salt castor sugar tonite sauted tender meat black fungus braised tofu special sauce gold medal emojigood pork rib pineapple qiubi prawn interestingly orange juice dragon fruit soya bean milk offered acquired taste especially flavours soy black fungus braised tofu special sauce,salt castor sugar tonit saut tender meat black fungu brais tofu special sauc gold medal good pork rib pineappl qiubi prawn interestingli orang juic dragon fruit soya bean milk offer acquir tast especi flavour soy black fungu brais tofu special sauc,salt castor sugar tonite sauted tender meat black fungus braised tofu special sauce gold medal good pork rib pineapple qiubi prawn interestingly orange juice dragon fruit soya bean milk offered acquired taste especially flavour soy black fungus braised tofu special sauce,salt castor sugar tonit saut tender meat black fungu brais tofu special sauc gold medal emojigood pork rib pineappl qiubi prawn interestingli orang juic dragon fruit soya bean milk offer acquir tast especi flavour soy black fungu brais tofu special sauc,salt castor sugar tonite sauted tender meat black fungus braised tofu special sauce gold medal emojigood pork rib pineapple qiubi prawn interestingly orange juice dragon fruit soya bean milk offered acquired taste especially flavour soy black fungus braised tofu special sauce,1.0
bigmama-korean-restaurant,Big Mama Flavours,MichelleLIN T,food,chi soup set came mama flavourslovely dishes,chi soup set came mama flavourslovely dish,chi soup set came mama flavourslov dish,chi soup set came mama flavourslovely dishes,chi soup set came mama flavourslovely dishes,chi soup set came mama flavourslov dish,chi soup set came mama flavourslovely dish,chi soup set came mama flavourslov dish,chi soup set came mama flavourslovely dish,1.0
bigmama-korean-restaurant,Big Mama Flavours,MichelleLIN T,portion,came pretty small pot soup rice,came pretty small pot soup rice,came pretti small pot soup rice,came pretty small pot soup rice,came pretty small pot soup rice,came pretti small pot soup rice,came pretty small pot soup rice,came pretti small pot soup rice,came pretty small pot soup rice,-1.0
bigmama-korean-restaurant,Big Mama Flavours,MichelleLIN T,price,little pricey affordable set lunch option,little pricey affordable set lunch option,littl pricey afford set lunch option,little pricey affordable set lunch option,little pricey affordable set lunch option,littl pricey afford set lunch option,little pricey affordable set lunch option,littl pricey afford set lunch option,little pricey affordable set lunch option,0.0
bigmama-korean-restaurant,"just so much #goodness in one #pan.
#food #foodies #dakgalbi #chicken #korean #style #korea #bigmama #yumz #dinner #igsg #instafood #instasg #instagood #instagramsg #foodpics #foodporn #hot #favkoreanfood",recca tricia,food,goodness pan korean style,goodness pan korean style,good pan korean style,goodness pan korean style,goodness pan korean style,good pan korean style,goodness pan korean style,good pan korean style,goodness pan korean style,1.0
black-nut,"Almost thinking about the ""Not A Cock Up"" AFC (Asian Fried Chicken) Wings - pinnacle vodka infused crispy wings - I had less than a hundred minutes ago at Black Nut, a newly-opened buah keluak-inspired bar on Emerald Hill.",Shawn Loh,food,fried chicken wings pinnacle vodka infused,fried chicken wing pinnacle vodka infused,fri chicken wing pinnacl vodka infus,fried chicken wings pinnacle vodka infused,fried chicken wings pinnacle vodka infused,fri chicken wing pinnacl vodka infus,fried chicken wing pinnacle vodka infused,fri chicken wing pinnacl vodka infus,fried chicken wing pinnacle vodka infused,0.0
black-nut,"I am a zhi char kind of (Kok Sen really) Har Cheong Kai (chicken in prawn paste batter, deed fried until shiok) kind of guy.",Traveling Noodle,food,har cheong kai chicken prawn paste ranks good ones bloody tasty juicy meat dry,har cheong kai chicken prawn paste rank good one bloody tasty juicy meat dry,har cheong kai chicken prawn past rank good one bloodi tasti juici meat dri,har cheong kai chicken prawn paste ranks good ones bloody tasty juicy meat dry,har cheong kai chicken prawn paste ranks good ones bloody tasty juicy meat dry,har cheong kai chicken prawn past rank good one bloodi tasti juici meat dri,har cheong kai chicken prawn paste rank good one bloody tasty juicy meat dry,har cheong kai chicken prawn past rank good one bloodi tasti juici meat dri,har cheong kai chicken prawn paste rank good one bloody tasty juicy meat dry,1.0
black-nut,This Threesome Awesome was just awesome.,Traveling Noodle,food,awesome food drinks great company malchie debbygreenweed food drinks,awesome food drink great company malchie debbygreenweed food drink,awesom food drink great compani malchi debbygreenwe food drink,awesome food drinks great company malchie debbygreenweed food drinks,awesome food drinks great company malchie debbygreenweed food drinks,awesom food drink great compani malchi debbygreenwe food drink,awesome food drink great company malchie debbygreenweed food drink,awesom food drink great compani malchi debbygreenwe food drink,awesome food drink great company malchie debbygreenweed food drink,1.0
black-nut,This Threesome Awesome was just awesome.,Traveling Noodle,service,awesome,awesome,awesom,awesome,awesome,awesom,awesome,awesom,awesome,1.0
blackball-at-amk-hub,Blackball Signature Dessert Deluxe with Tofu Pudding Base,Siming T,food,dessert deluxe tofu pudding basetoday enlisted help foodpanda deliver heavy duty desserts office jiu fen taro balls sweet potato red beans pearls simply adds chewy texture awesome dessert authentic easily taste bite,dessert deluxe tofu pudding basetoday enlisted help foodpanda deliver heavy duty dessert office jiu fen taro ball sweet potato red bean pearl simply add chewy texture awesome dessert authentic easily taste bite,dessert delux tofu pud basetoday enlist help foodpanda deliv heavi duti dessert offic jiu fen taro ball sweet potato red bean pearl simpli add chewi textur awesom dessert authent easili tast bite,dessert deluxe tofu pudding basetoday enlisted help foodpanda deliver heavy duty desserts office jiu fen taro balls sweet potato red beans pearls simply adds chewy texture awesome dessert authentic easily taste bite,dessert deluxe tofu pudding basetoday enlisted help foodpanda deliver heavy duty desserts office jiu fen taro balls sweet potato red beans pearls simply adds chewy texture awesome dessert authentic easily taste bite,dessert delux tofu pud basetoday enlist help foodpanda deliv heavi duti dessert offic jiu fen taro ball sweet potato red bean pearl simpli add chewi textur awesom dessert authent easili tast bite,dessert deluxe tofu pudding basetoday enlisted help foodpanda deliver heavy duty dessert office jiu fen taro ball sweet potato red bean pearl simply add chewy texture awesome dessert authentic easily taste bite,dessert delux tofu pud basetoday enlist help foodpanda deliv heavi duti dessert offic jiu fen taro ball sweet potato red bean pearl simpli add chewi textur awesom dessert authent easili tast bite,dessert deluxe tofu pudding basetoday enlisted help foodpanda deliver heavy duty dessert office jiu fen taro ball sweet potato red bean pearl simply add chewy texture awesome dessert authentic easily taste bite,1.0
blackball-at-amk-hub,Blackball Signature Dessert Deluxe with Tofu Pudding Base,Siming T,portion,finish big bowl given large portion,finish big bowl given large portion,finish big bowl given larg portion,finish big bowl given large portion,finish big bowl given large portion,finish big bowl given larg portion,finish big bowl given large portion,finish big bowl given larg portion,finish big bowl given large portion,1.0
blackball-at-amk-hub,Gift :),Milo Kosong,ambience,sweet ambiance nil service,sweet ambiance nil service,sweet ambianc nil servic,sweet ambiance nil service,sweet ambiance nil service,sweet ambianc nil servic,sweet ambiance nil service,sweet ambianc nil servic,sweet ambiance nil service,1.0
blackball-at-amk-hub,Gift :),Milo Kosong,food,matcha tea,matcha tea,matcha tea,matcha tea,matcha tea,matcha tea,matcha tea,matcha tea,matcha tea,0.0
blackball-at-amk-hub,Promotion,Doreen Tan,food,purple potato combo tofu beancurd,purple potato combo tofu beancurd,purpl potato combo tofu beancurd,purple potato combo tofu beancurd,purple potato combo tofu beancurd,purpl potato combo tofu beancurd,purple potato combo tofu beancurd,purpl potato combo tofu beancurd,purple potato combo tofu beancurd,0.0
blackball-at-amk-hub,TARO BALLS!!,Amanda Yap,food,balls bit pricey shiok dinner singapore crazy hot weather ordered blackball cold chinchow base bouncy chewy sweet potato red bean yum pearl refreshing shiok dinner singapore crazy hot weather ordered blackball,ball bit pricey shiok dinner singapore crazy hot weather ordered blackball cold chinchow base bouncy chewy sweet potato red bean yum pearl refreshing shiok dinner singapore crazy hot weather ordered blackball,ball bit pricey shiok dinner singapor crazi hot weather order blackbal cold chinchow base bounci chewi sweet potato red bean yum pearl refresh shiok dinner singapor crazi hot weather order blackbal,balls bit pricey shiok dinner singapore crazy hot weather ordered blackball cold chinchow base bouncy chewy sweet potato red bean yum pearl refreshing shiok dinner singapore crazy hot weather ordered blackball,balls bit pricey shiok dinner singapore crazy hot weather ordered blackball cold chinchow base bouncy chewy sweet potato red bean yum pearl refreshing shiok dinner singapore crazy hot weather ordered blackball,ball bit pricey shiok dinner singapor crazi hot weather order blackbal cold chinchow base bounci chewi sweet potato red bean yum pearl refresh shiok dinner singapor crazi hot weather order blackbal,ball bit pricey shiok dinner singapore crazy hot weather ordered blackball cold chinchow base bouncy chewy sweet potato red bean yum pearl refreshing shiok dinner singapore crazy hot weather ordered blackball,ball bit pricey shiok dinner singapor crazi hot weather order blackbal cold chinchow base bounci chewi sweet potato red bean yum pearl refresh shiok dinner singapor crazi hot weather order blackbal,ball bit pricey shiok dinner singapore crazy hot weather ordered blackball cold chinchow base bouncy chewy sweet potato red bean yum pearl refreshing shiok dinner singapore crazy hot weather ordered blackball,1.0
blk-143-teck-whye-coffee-shop,Char Siew Wanton Noodles,Shania A.W,food,charsiew wanton noodles favourite like charsiew sauce not salty,charsiew wanton noodle favourite like charsiew sauce not salty,charsiew wanton noodl favourit like charsiew sauc not salti,charsiew wanton noodles favourite like charsiew sauce not salty,charsiew wanton noodles favourite like charsiew sauce not salty,charsiew wanton noodl favourit like charsiew sauc not salti,charsiew wanton noodle favourite like charsiew sauce not salty,charsiew wanton noodl favourit like charsiew sauc not salti,charsiew wanton noodle favourite like charsiew sauce not salty,1.0
blk-143-teck-whye-coffee-shop,Lai Heng Prawn Noodles ,Jia Yu Chan,food,old school version prawn noodle dark sauce,old school version prawn noodle dark sauce,old school version prawn noodl dark sauc,old school version prawn noodle dark sauce,old school version prawn noodle dark sauce,old school version prawn noodl dark sauc,old school version prawn noodle dark sauce,old school version prawn noodl dark sauc,old school version prawn noodle dark sauce,0.0
blk-143-teck-whye-coffee-shop,dry prawn noodles ($4.50) @ teck whye,Fabian Poon,food,prawn noodles scooping oil chili dark soya bowl ungracefully stained liquid,prawn noodle scooping oil chili dark soya bowl ungracefully stained liquid,prawn noodl scoop oil chili dark soya bowl ungrac stain liquid,prawn noodles scooping oil chili dark soya bowl ungracefully stained liquid,prawn noodles scooping oil chili dark soya bowl ungracefully stained liquid,prawn noodl scoop oil chili dark soya bowl ungrac stain liquid,prawn noodle scooping oil chili dark soya bowl ungracefully stained liquid,prawn noodl scoop oil chili dark soya bowl ungrac stain liquid,prawn noodle scooping oil chili dark soya bowl ungracefully stained liquid,0.0
blk-16-bedok-south-market-n-hawker-centre,Brekkie last morn.,Big Roy,food,white beehoon stall pretty good ngoh hiang white beehoon stall pretty good ngoh hiang,white beehoon stall pretty good ngoh hiang white beehoon stall pretty good ngoh hiang,white beehoon stall pretti good ngoh hiang white beehoon stall pretti good ngoh hiang,white beehoon stall pretty good ngoh hiang white beehoon stall pretty good ngoh hiang,white beehoon stall pretty good ngoh hiang white beehoon stall pretty good ngoh hiang,white beehoon stall pretti good ngoh hiang white beehoon stall pretti good ngoh hiang,white beehoon stall pretty good ngoh hiang white beehoon stall pretty good ngoh hiang,white beehoon stall pretti good ngoh hiang white beehoon stall pretti good ngoh hiang,white beehoon stall pretty good ngoh hiang white beehoon stall pretty good ngoh hiang,1.0
blk-16-bedok-south-market-n-hawker-centre,Fresh Crispy Youtiao,Serene Tan,food,crispy light airy youtiao,crispy light airy youtiao,crispi light airi youtiao,good crispy light airy youtiao,emojigood crispy light airy youtiao,good crispi light airi youtiao,good crispy light airy youtiao,emojigood crispi light airi youtiao,emojigood crispy light airy youtiao,0.0
blk-16-bedok-south-market-n-hawker-centre,Minced Meat Noodles,Kevin M,food,minced meat tasty mushroom minced mix sambal chilli springy noodles satisfying experience,minced meat tasty mushroom minced mix sambal chilli springy noodle satisfying experience,minc meat tasti mushroom minc mix sambal chilli springi noodl satisfi experi,minced meat tasty mushroom minced mix sambal chilli springy noodles satisfying experience,minced meat tasty mushroom minced mix sambal chilli springy noodles satisfying experience,minc meat tasti mushroom minc mix sambal chilli springi noodl satisfi experi,minced meat tasty mushroom minced mix sambal chilli springy noodle satisfying experience,minc meat tasti mushroom minc mix sambal chilli springi noodl satisfi experi,minced meat tasty mushroom minced mix sambal chilli springy noodle satisfying experience,1.0
blk-16-bedok-south-market-n-hawker-centre,"Seafood bak chor mee
First time trying out this combo from 'Yong He' .",Makan Warrior,food,bak chor mee time trying combo yong bcm prawn shell fish lying lack vinegar adding taste better wet type tasty seafood add nice soup time trying combo yong,bak chor mee time trying combo yong bcm prawn shell fish lying lack vinegar adding taste better wet type tasty seafood add nice soup time trying combo yong,bak chor mee time tri combo yong bcm prawn shell fish lie lack vinegar ad tast better wet type tasti seafood add nice soup time tri combo yong,bak chor mee time trying combo yong bcm prawn shell fish lying lack vinegar adding taste better wet type tasty seafood add nice soup time trying combo yong,bak chor mee time trying combo yong bcm prawn shell fish lying lack vinegar adding taste better wet type tasty seafood add nice soup time trying combo yong,bak chor mee time tri combo yong bcm prawn shell fish lie lack vinegar ad tast better wet type tasti seafood add nice soup time tri combo yong,bak chor mee time trying combo yong bcm prawn shell fish lying lack vinegar adding taste better wet type tasty seafood add nice soup time trying combo yong,bak chor mee time tri combo yong bcm prawn shell fish lie lack vinegar ad tast better wet type tasti seafood add nice soup time tri combo yong,bak chor mee time trying combo yong bcm prawn shell fish lying lack vinegar adding taste better wet type tasty seafood add nice soup time trying combo yong,0.0
blk-161-bukit-merah-central-coffee-shop,Economical Rice,Thiam Peng Tan,food,ricebraised pork belly brinjal black pepper chicken disgusting riceginger onion chicken salted egg prawn paste,ricebraised pork belly brinjal black pepper chicken disgusting riceginger onion chicken salted egg prawn paste,ricebrais pork belli brinjal black pepper chicken disgust riceging onion chicken salt egg prawn past,ricebraised pork belly brinjal black pepper chicken disgusting riceginger onion chicken salted egg prawn paste,ricebraised pork belly brinjal black pepper chicken disgusting riceginger onion chicken salted egg prawn paste,ricebrais pork belli brinjal black pepper chicken disgust riceging onion chicken salt egg prawn past,ricebraised pork belly brinjal black pepper chicken disgusting riceginger onion chicken salted egg prawn paste,ricebrais pork belli brinjal black pepper chicken disgust riceging onion chicken salt egg prawn past,ricebraised pork belly brinjal black pepper chicken disgusting riceginger onion chicken salted egg prawn paste,-1.0
blk-85-bedok-north-seng-hiang-bak-chor-mee,"Bak Chor Mee Soup🙃 Seng Hiang Bak Chor Mee | 85 Fengshan Food Centre @ Bedok
#singaporefood #sgfood #sgeats #instafood #instafoodsg #foodhunt #foodporn #foodsg #foodpornsg #exploresingaporeeats #exsgcafes #burpple #uncagestreetfood #exploresingapore #singaporeinsiders #sghawker #hawkersg #hawkerfood #streeteats #eatoutsg #sgigfoodies #sgfoodies #foodshare",Piggy YJ,food,bak chor mee,bak chor mee,bak chor mee,bak chor mee,bak chor mee,bak chor mee,bak chor mee,bak chor mee,bak chor mee,0.0
blk-85-bedok-north-seng-hiang-bak-chor-mee,Pigs Can't Fly But Many Would Fly Here For This Pork Dish,Brenda Yeo,food,fly pork disha good mushroom version comes home sg never no bcm visit fengshan market better known bedok certain taste,fly pork disha good mushroom version come home sg never no bcm visit fengshan market better known bedok certain taste,fli pork disha good mushroom version come home sg never no bcm visit fengshan market better known bedok certain tast,fly pork disha good mushroom version comes home sg never no bcm visit fengshan market better known bedok certain taste,fly pork disha good mushroom version comes home sg never no bcm visit fengshan market better known bedok certain taste,fli pork disha good mushroom version come home sg never no bcm visit fengshan market better known bedok certain tast,fly pork disha good mushroom version come home sg never no bcm visit fengshan market better known bedok certain taste,fli pork disha good mushroom version come home sg never no bcm visit fengshan market better known bedok certain tast,fly pork disha good mushroom version come home sg never no bcm visit fengshan market better known bedok certain taste,1.0
blk-85-bedok-north-seng-hiang-bak-chor-mee,Pigs Can't Fly But Many Would Fly Here For This Pork Dish,Brenda Yeo,service,good,good,good,good,good,good,good,good,good,1.0
blk-85-bedok-north-seng-hiang-bak-chor-mee,Pigs Can't Fly But Many Would Fly Here For This Pork Dish,Brenda Yeo,time,disha dollar bowl minutes waiting equally long queues,disha dollar bowl minute waiting equally long queue,disha dollar bowl minut wait equal long queue,disha dollar bowl minutes waiting equally long queues,disha dollar bowl minutes waiting equally long queues,disha dollar bowl minut wait equal long queue,disha dollar bowl minute waiting equally long queue,disha dollar bowl minut wait equal long queue,disha dollar bowl minute waiting equally long queue,0.0
blk-85-bedok-north-seng-hiang-bak-chor-mee,Soup Bak Chor Mee ($2.50/3),Ade Tan,food,bak chor mee good springy tasty pungent alkaliney taste egg noodles amazing outshone broth infused minced pork comforting bowl soup bakchormee,bak chor mee good springy tasty pungent alkaliney taste egg noodle amazing outshone broth infused minced pork comforting bowl soup bakchormee,bak chor mee good springi tasti pungent alkaliney tast egg noodl amaz outshon broth infus minc pork comfort bowl soup bakchorme,bak chor mee good springy tasty pungent alkaliney taste egg noodles amazing outshone broth infused minced pork comforting bowl soup bakchormee,bak chor mee good springy tasty pungent alkaliney taste egg noodles amazing outshone broth infused minced pork comforting bowl soup bakchormee,bak chor mee good springi tasti pungent alkaliney tast egg noodl amaz outshon broth infus minc pork comfort bowl soup bakchorme,bak chor mee good springy tasty pungent alkaliney taste egg noodle amazing outshone broth infused minced pork comforting bowl soup bakchormee,bak chor mee good springi tasti pungent alkaliney tast egg noodl amaz outshon broth infus minc pork comfort bowl soup bakchorme,bak chor mee good springy tasty pungent alkaliney taste egg noodle amazing outshone broth infused minced pork comforting bowl soup bakchormee,1.0
blk-85-bedok-north-seng-hiang-bak-chor-mee,Soup Bak Chor Mee ($2.50/3),Ade Tan,portion,large good,large good,larg good,large good,large good,larg good,large good,larg good,large good,1.0
blk-85-bedok-north-seng-hiang-bak-chor-mee,Soup Bak Chor Mee ($2.50/3),Ade Tan,service,good,good,good,good,good,good,good,good,good,1.0
blk-85-bedok-north-seng-hiang-bak-chor-mee,Soup(Small) 2.5nett,Wuu Yyiizzhhoouu,food,garlic taste strong meatballs run oil overpowers soup little closer tsukemen noodles,garlic taste strong meatball run oil overpowers soup little closer tsukemen noodle,garlic tast strong meatbal run oil overpow soup littl closer tsukemen noodl,garlic taste strong meatballs run oil overpowers soup little closer tsukemen noodles,garlic taste strong meatballs run oil overpowers soup little closer tsukemen noodles,garlic tast strong meatbal run oil overpow soup littl closer tsukemen noodl,garlic taste strong meatball run oil overpowers soup little closer tsukemen noodle,garlic tast strong meatbal run oil overpow soup littl closer tsukemen noodl,garlic taste strong meatball run oil overpowers soup little closer tsukemen noodle,0.0
blk-85-bedok-north-seng-hiang-bak-chor-mee,Soup(Small) 2.5nett,Wuu Yyiizzhhoouu,portion,smaller,smaller,smaller,smaller,smaller,smaller,smaller,smaller,smaller,-1.0
blk-85-bedok-north-seng-hiang-bak-chor-mee,Soup(Small) 2.5nett,Wuu Yyiizzhhoouu,price,comforting option definitely worth,comforting option definitely worth,comfort option definit worth,comforting option definitely worth,comforting option definitely worth,comfort option definit worth,comforting option definitely worth,comfort option definit worth,comforting option definitely worth,1.0
blk-85-bedok-north-seng-hiang-bak-chor-mee,Soup(Small) 2.5nett,Wuu Yyiizzhhoouu,time,definitely worth,definitely worth,definit worth,definitely worth,definitely worth,definit worth,definitely worth,definit worth,definitely worth,1.0
botanico,Duck And Potatoes,Selina Thomas,food,potatoesi starter botanico fried potato cubes nice bite oily duck meat,potatoesi starter botanico fried potato cube nice bite oily duck meat,potatoesi starter botanico fri potato cube nice bite oili duck meat,potatoesi starter botanico fried potato cubes nice bite oily duck meat,potatoesi starter botanico fried potato cubes nice bite oily duck meat,potatoesi starter botanico fri potato cube nice bite oili duck meat,potatoesi starter botanico fried potato cube nice bite oily duck meat,potatoesi starter botanico fri potato cube nice bite oili duck meat,potatoesi starter botanico fried potato cube nice bite oily duck meat,1.0
